reviewID,sentenceID,sentenceText,processedText,sentimentScore,target,category,part,polarity
1451107,1451107:1,Our family never expected such incredible entertainment in a restaurant.,our family never expected such incredible entertainment in a restaurant,0.4215,restaurant,restaurant general,3,positive
1451107,1451107:4,Our food was great too!,our food was great too,0.6588,food,food quality,3,positive
1451107,1451107:5,And really large portions.,and really large portions,0.0,portions,food style options,3,positive
1451107,1451107:6,The staff was the friendliest that have seen in New York.,the staff was the friendliest that have seen in new york,0.5574,staff,service general,3,positive
1451107,1451107:7,We will go back every time we are in the City.,we will go back every time we are in the city,0.0,null,restaurant general,3,positive
1451109,1451109:0,If you want something really different than try Jekyll and Hyde.,if you want something really different than try jekyll and hyde,0.0772,jekyll and hyde,restaurant general,3,positive
1451109,1451109:1,It is a lot of fun with live entertainment and all kinds of Disney type special effects.,it is a lot of fun with live entertainment and all kinds of disney type special effects,0.8316,null,ambience general,3,positive
1451109,1451109:2,The food was pretty tradional but it was hot and good with large portions.,the food was pretty tradional but it was hot and good with large portions,0.714,food,food quality,3,positive
1451109,1451109:2,The food was pretty tradional but it was hot and good with large portions.,the food was pretty tradional but it was hot and good with large portions,0.714,portions,food style options,3,positive
1451109,1451109:3,I highly recommend it.,i highly recommend it,0.4201,null,restaurant general,3,positive
1457607,1457607:0,The place is a lot of fun.,the place is a lot of fun,0.5106,place,ambience general,3,positive
1457607,1457607:1,My six year old loved it.,my six year old loved it,0.5994,null,restaurant general,3,positive
1457607,1457607:2,The characters really make for an enjoyable experience.,the characters really make for an enjoyable experience,0.4404,characters,ambience general,3,positive
1457607,1457607:3,"The food however, is what one might expect.",the food however is what one might expect,0.0,food,food quality,3,negative
1457607,1457607:4,It is very overpriced and not very tasty.,it is very overpriced and not very tasty,0.0,null,food quality,3,negative
1457607,1457607:4,It is very overpriced and not very tasty.,it is very overpriced and not very tasty,0.0,null,food prices,3,negative
1457607,1457607:5,"However, I think Jeckll and Hydes t is one of those places that is fun to do once.",however i think jeckll and hydes t is one of those places that is fun to do once,0.5106,jeckll and hydes,restaurant general,3,positive
1457607,1457607:6,We had a good time.,we had a good time,0.4404,null,restaurant general,3,positive
1459569,1459569:0,Went there with my wife and we had to wait for a table even though you could see there many that were empty with not reservation sigh on them.,went there with my wife and we had to wait for a table even though you could see there many that were empty with not reservation sigh on them,-0.2201,null,service general,3,negative
1459569,1459569:1,Service was slow had to wait to order and get food although not crowded.,service was slow had to wait to order and get food although not crowded,0.0,service,service general,3,negative
1459569,1459569:2,Drinks way over priced.,drinks way over priced,0.0,drinks,drinks prices,3,negative
1459569,1459569:3,Food was good not great not worth the wait or another visit,food was good not great not worth the wait or another visit,0.0255,food,food quality,3,neutral
1459569,1459569:3,Food was good not great not worth the wait or another visit,food was good not great not worth the wait or another visit,0.0255,null,restaurant general,3,negative
1460715,1460715:0,Great pizza for lunch place.,great pizza for lunch place,0.6249,pizza,food quality,3,positive
1460715,1460715:1,Service was quick.,service was quick,0.0,service,service general,3,positive
1460715,1460715:2,The pizza was great.,the pizza was great,0.6249,pizza,food quality,3,positive
1460715,1460715:3,And it was quick which is very important.,and it was quick which is very important,0.2716,null,service general,3,positive
1460715,1460715:4,Have the iced tea.,have the iced tea,0.0,iced tea,drinks quality,3,positive
1460715,1460715:5,It was wonderful.,it was wonderful,0.5719,null,drinks quality,3,positive
1470286,1470286:0,"Whenever you need a Sushi fix, Mizu will be there with quality fish and great service.",whenever you need a sushi fix mizu will be there with quality fish and great service,0.6249,fish,food quality,3,positive
1470286,1470286:0,"Whenever you need a Sushi fix, Mizu will be there with quality fish and great service.",whenever you need a sushi fix mizu will be there with quality fish and great service,0.6249,service,service general,3,positive
1470286,1470286:1,Delivery is fast too.,delivery is fast too,0.0,delivery,service general,3,positive
1470286,1470286:2,"Great friendly service, Fast seating, Fast Delivery, Excellent sushi.",great friendly service fast seating fast delivery excellent sushi,0.9001,service,service general,3,positive
1470286,1470286:2,"Great friendly service, Fast seating, Fast Delivery, Excellent sushi.",great friendly service fast seating fast delivery excellent sushi,0.9001,seating,service general,3,positive
1470286,1470286:2,"Great friendly service, Fast seating, Fast Delivery, Excellent sushi.",great friendly service fast seating fast delivery excellent sushi,0.9001,delivery,service general,3,positive
1470286,1470286:2,"Great friendly service, Fast seating, Fast Delivery, Excellent sushi.",great friendly service fast seating fast delivery excellent sushi,0.9001,sushi,food quality,3,positive
1470286,1470286:3,A little overpriced but worth it once you take a bite.,a little overpriced but worth it once you take a bite,0.2393,null,food prices,3,negative
1470286,1470286:3,A little overpriced but worth it once you take a bite.,a little overpriced but worth it once you take a bite,0.2393,null,food quality,3,positive
1470334,1470334:1,Ess-A-Bagel (either by Sty-town or midtown) is by far the best bagel in NY.,ess a bagel either by sty town or midtown is by far the best bagel in ny,0.6369,bagel,food quality,3,positive
1470334,1470334:2,"The bagels always warm, soft on the inside, crispy on the outside and enormous in size.",the bagels always warm soft on the inside crispy on the outside and enormous in size,0.2263,bagels,food quality,3,positive
1470334,1470334:2,"The bagels always warm, soft on the inside, crispy on the outside and enormous in size.",the bagels always warm soft on the inside crispy on the outside and enormous in size,0.2263,bagels,food style options,3,positive
1470334,1470334:3,They have a huge selection of different cream cheeses and all of their salads are great.,they have a huge selection of different cream cheeses and all of their salads are great,0.7506,salads,food quality,3,positive
1470334,1470334:3,They have a huge selection of different cream cheeses and all of their salads are great.,they have a huge selection of different cream cheeses and all of their salads are great,0.7506,cream cheeses,food style options,3,positive
1470334,1470334:4,The lox is always fresh too.,the lox is always fresh too,0.3182,lox,food quality,3,positive
1470334,1470334:5,Highly recommended to all!,highly recommended to all,0.3367,null,restaurant general,3,positive
1471273,1471273:2,Not impressed with the food.,not impressed with the food,-0.3724,food,food quality,3,negative
1471273,1471273:3,Prices too high for this cramped and unappealing resturant.,prices too high for this cramped and unappealing resturant,0.0,resturant,restaurant prices,3,negative
1471273,1471273:3,Prices too high for this cramped and unappealing resturant.,prices too high for this cramped and unappealing resturant,0.0,resturant,ambience general,3,negative
1471273,1471273:4,Zero ambiance to boot.,zero ambiance to boot,0.0,ambiance,ambience general,3,negative
1476493,1476493:0,I thought this place was totally overrated.,i thought this place was totally overrated,0.0,place,restaurant general,3,negative
1476493,1476493:1,Everything we had was good or ok....but definitely nothing great.,everything we had was good or ok but definitely nothing great,0.3195,null,restaurant general,3,neutral
1476493,1476493:2,"The ambience was nice, but service wasn't so great.",the ambience was nice but service wasn t so great,-0.7011,ambience,ambience general,3,positive
1476493,1476493:2,"The ambience was nice, but service wasn't so great.",the ambience was nice but service wasn t so great,-0.7011,service,service general,3,negative
1476493,1476493:3,"When you add it all together, it just doesn't seem worth it to me...especially considering the prices.",when you add it all together it just doesn t seem worth it to me especially considering the prices,-0.1695,null,restaurant general,3,negative
1476493,1476493:3,"When you add it all together, it just doesn't seem worth it to me...especially considering the prices.",when you add it all together it just doesn t seem worth it to me especially considering the prices,-0.1695,null,restaurant prices,3,negative
1477631,1477631:0,This is the BEST Shabu-Shabu Restaurant in the Try-State Area.,this is the best shabu shabu restaurant in the try state area,0.7125,shabu shabu restaurant,restaurant general,3,positive
1477631,1477631:1,I have lived in Japan for 7 years and the taste of the food and the feel of the restaurant is like being back in Japan.,i have lived in japan for 7 years and the taste of the food and the feel of the restaurant is like being back in japan,0.3612,food,food quality,3,positive
1477631,1477631:1,I have lived in Japan for 7 years and the taste of the food and the feel of the restaurant is like being back in Japan.,i have lived in japan for 7 years and the taste of the food and the feel of the restaurant is like being back in japan,0.3612,feel,ambience general,3,positive
1477631,1477631:2,Thius is a must for anyone who loves Shabu-Shabu.,thius is a must for anyone who loves shabu shabu,0.5719,shabu shabu,food quality,3,positive
1486041,1486041:0,"The atmosphere is nothing special, but it feels like a Sushi establishment in Tokyo.",the atmosphere is nothing special but it feels like a sushi establishment in tokyo,0.3861,atmosphere,ambience general,3,positive
1486041,1486041:1,The owner and staff are all Japanese as well and that adds to the entire ambiance.,the owner and staff are all japanese as well and that adds to the entire ambiance,0.2732,owner,restaurant miscellaneous,3,positive
1486041,1486041:1,The owner and staff are all Japanese as well and that adds to the entire ambiance.,the owner and staff are all japanese as well and that adds to the entire ambiance,0.2732,staff,restaurant miscellaneous,3,positive
1486041,1486041:1,The owner and staff are all Japanese as well and that adds to the entire ambiance.,the owner and staff are all japanese as well and that adds to the entire ambiance,0.2732,ambiance,ambience general,3,positive
1486041,1486041:2,"Despite a slightly limited menu, everything prepared is done to perfection, ultra fresh and a work of food art.",despite a slightly limited menu everything prepared is done to perfection ultra fresh and a work of food art,0.81,menu,food style options,3,negative
1486041,1486041:2,"Despite a slightly limited menu, everything prepared is done to perfection, ultra fresh and a work of food art.",despite a slightly limited menu everything prepared is done to perfection ultra fresh and a work of food art,0.81,null,food quality,3,positive
1486041,1486041:2,"Despite a slightly limited menu, everything prepared is done to perfection, ultra fresh and a work of food art.",despite a slightly limited menu everything prepared is done to perfection ultra fresh and a work of food art,0.81,null,food style options,3,positive
1486041,1486041:3,I must give it Yon out of Yon stars!,i must give it yon out of yon stars,0.0,null,restaurant general,3,positive
1486041,1486041:4,Taxan delicious!,taxan delicious,0.6114,taxan,food quality,3,positive
1490757,1490757:0,"This restaurant was recommended by a local...as a matter of fact, he made the reservation for us and said we would not be disappointed!",this restaurant was recommended by a local as a matter of fact he made the reservation for us and said we would not be disappointed,0.5784,null,restaurant general,3,positive
1490757,1490757:2,The prices were CHEAP compared to the quality of service and food.,the prices were cheap compared to the quality of service and food,0.0,null,restaurant prices,3,positive
1490757,1490757:2,The prices were CHEAP compared to the quality of service and food.,the prices were cheap compared to the quality of service and food,0.0,service,service general,3,positive
1490757,1490757:2,The prices were CHEAP compared to the quality of service and food.,the prices were cheap compared to the quality of service and food,0.0,food,food quality,3,positive
1490757,1490757:3,"We liked it so much, that we will always make it a point to dine here when we visit New York.",we liked it so much that we will always make it a point to dine here when we visit new york,0.4215,null,restaurant general,3,positive
1496205,1496205:1,The location and ambience is Ok but the food is what makes up for it.,the location and ambience is ok but the food is what makes up for it,0.1531,location,location general,3,neutral
1496205,1496205:1,The location and ambience is Ok but the food is what makes up for it.,the location and ambience is ok but the food is what makes up for it,0.1531,ambience,ambience general,3,neutral
1496205,1496205:1,The location and ambience is Ok but the food is what makes up for it.,the location and ambience is ok but the food is what makes up for it,0.1531,food,food quality,3,positive
1496205,1496205:2,There is a lot of variety even for people who eat vegetarian like me.,there is a lot of variety even for people who eat vegetarian like me,0.3612,null,food style options,3,positive
1496205,1496205:3,Try green curry with vegetables.,try green curry with vegetables,0.0,green curry with vegetables,food quality,3,positive
1496205,1496205:4,"The quantity is also very good, you will come out satisfied.",the quantity is also very good you will come out satisfied,0.7178,null,food style options,3,positive
1496205,1496205:5,"The service is ok, some of the people didn't get what they asked for.",the service is ok some of the people didn t get what they asked for,0.296,service,service general,3,neutral
1496707,1496707:0,I was there on sat. for my birthday and we had an excellent time.,i was there on sat for my birthday and we had an excellent time,0.5719,null,restaurant general,3,positive
1496707,1496707:1,I had the best ravioli ever.,i had the best ravioli ever,0.6369,ravioli,food quality,3,positive
1496707,1496707:2,The wine the service was very good too.,the wine the service was very good too,0.4927,wine,drinks quality,3,positive
1496707,1496707:2,The wine the service was very good too.,the wine the service was very good too,0.4927,service,service general,3,positive
1496707,1496707:3,Moderate prices.,moderate prices,0.0,null,restaurant prices,3,neutral
1496707,1496707:4,A little noise but I think that was because of our party!,a little noise but i think that was because of our party,0.5916,null,ambience general,3,neutral
1500453,1500453:1,This quaint and romantic trattoria is at the top of my Manhattan restaurant list.,this quaint and romantic trattoria is at the top of my manhattan restaurant list,0.5423,trattoria,ambience general,3,positive
1500453,1500453:1,This quaint and romantic trattoria is at the top of my Manhattan restaurant list.,this quaint and romantic trattoria is at the top of my manhattan restaurant list,0.5423,trattoria,restaurant general,3,positive
1500453,1500453:2,"The food is delicious - from the specials to the regular menu-fare, the dishes are never a disappointment.",the food is delicious from the specials to the regular menu fare the dishes are never a disappointment,0.7508,food,food quality,3,positive
1500453,1500453:2,"The food is delicious - from the specials to the regular menu-fare, the dishes are never a disappointment.",the food is delicious from the specials to the regular menu fare the dishes are never a disappointment,0.7508,dishes,food quality,3,positive
1500453,1500453:2,"The food is delicious - from the specials to the regular menu-fare, the dishes are never a disappointment.",the food is delicious from the specials to the regular menu fare the dishes are never a disappointment,0.7508,specials,food quality,3,positive
1500453,1500453:2,"The food is delicious - from the specials to the regular menu-fare, the dishes are never a disappointment.",the food is delicious from the specials to the regular menu fare the dishes are never a disappointment,0.7508,regular menu fare,food quality,3,positive
1500453,1500453:3,"Whether it's the parmesean porcini souffle or the lamb glazed with balsamic vinegar, you will surely be transported to Northern Italy with one bite.",whether it s the parmesean porcini souffle or the lamb glazed with balsamic vinegar you will surely be transported to northern italy with one bite,0.4404,parmesean porcini souffle,food quality,3,positive
1500453,1500453:3,"Whether it's the parmesean porcini souffle or the lamb glazed with balsamic vinegar, you will surely be transported to Northern Italy with one bite.",whether it s the parmesean porcini souffle or the lamb glazed with balsamic vinegar you will surely be transported to northern italy with one bite,0.4404,lamb glazed with balsamic vinegar,food quality,3,positive
1500453,1500453:4,"Although the tables may be closely situated, the candle-light, food-quality and service overcompensate.",although the tables may be closely situated the candle light food quality and service overcompensate,0.0,candle light,ambience general,3,positive
1500453,1500453:4,"Although the tables may be closely situated, the candle-light, food-quality and service overcompensate.",although the tables may be closely situated the candle light food quality and service overcompensate,0.0,food,food quality,3,positive
1500453,1500453:4,"Although the tables may be closely situated, the candle-light, food-quality and service overcompensate.",although the tables may be closely situated the candle light food quality and service overcompensate,0.0,service,service general,3,positive
1500453,1500453:4,"Although the tables may be closely situated, the candle-light, food-quality and service overcompensate.",although the tables may be closely situated the candle light food quality and service overcompensate,0.0,tables,ambience general,3,negative
1500453,1500453:5,A guaranteeed delight!,a guaranteeed delight,0.636,null,restaurant general,3,positive
1506491,1506491:0,"I have known about this secret for the last 13 years, Emilio(the Godfather) has continued to serve food and wine for the gods at mortal prices.",i have known about this secret for the last 13 years emilio the godfather has continued to serve food and wine for the gods at mortal prices,0.0,food,food quality,4,positive
1506491,1506491:0,"I have known about this secret for the last 13 years, Emilio(the Godfather) has continued to serve food and wine for the gods at mortal prices.",i have known about this secret for the last 13 years emilio the godfather has continued to serve food and wine for the gods at mortal prices,0.0,wine,drinks quality,4,positive
1506491,1506491:0,"I have known about this secret for the last 13 years, Emilio(the Godfather) has continued to serve food and wine for the gods at mortal prices.",i have known about this secret for the last 13 years emilio the godfather has continued to serve food and wine for the gods at mortal prices,0.0,food,food prices,4,positive
1506491,1506491:0,"I have known about this secret for the last 13 years, Emilio(the Godfather) has continued to serve food and wine for the gods at mortal prices.",i have known about this secret for the last 13 years emilio the godfather has continued to serve food and wine for the gods at mortal prices,0.0,wine,drinks prices,4,positive
1506491,1506491:1,"If you go, try the marinara/arrabiatta sauce, the mozzarella en Carozza is mmmmmmmm..... everything is just delicious.",if you go try the marinara arrabiatta sauce the mozzarella en carozza is mmmmmmmm everything is just delicious,0.5719,marinara arrabiatta sauce,food quality,4,positive
1506491,1506491:1,"If you go, try the marinara/arrabiatta sauce, the mozzarella en Carozza is mmmmmmmm..... everything is just delicious.",if you go try the marinara arrabiatta sauce the mozzarella en carozza is mmmmmmmm everything is just delicious,0.5719,mozzarella en carozza,food quality,4,positive
1506491,1506491:1,"If you go, try the marinara/arrabiatta sauce, the mozzarella en Carozza is mmmmmmmm..... everything is just delicious.",if you go try the marinara arrabiatta sauce the mozzarella en carozza is mmmmmmmm everything is just delicious,0.5719,null,food quality,4,positive
1506491,1506491:2,Check out the secret back room.,check out the secret back room,0.0,back room,ambience general,4,positive
1506491,1506491:4,I pray it stays open forever.,i pray it stays open forever,0.3182,null,restaurant general,4,positive
1506491,1506491:5,Thank You Emilio.,thank you emilio,0.3612,emilio,restaurant general,4,positive
1538149,1538149:0,"I found the food, service and value exceptional everytime I have been there.",i found the food service and value exceptional everytime i have been there,0.34,food,food quality,4,positive
1538149,1538149:0,"I found the food, service and value exceptional everytime I have been there.",i found the food service and value exceptional everytime i have been there,0.34,service,service general,4,positive
1538149,1538149:0,"I found the food, service and value exceptional everytime I have been there.",i found the food service and value exceptional everytime i have been there,0.34,null,restaurant prices,4,positive
1538149,1538149:1,The food was authentic.,the food was authentic,0.0,food,food quality,4,positive
1538149,1538149:2,I felt as though I were eating in Paris.,i felt as though i were eating in paris,0.0,null,food quality,4,positive
1538149,1538149:3,The service was excellent - friendly and attentive.,the service was excellent friendly and attentive,0.7845,service,service general,4,positive
1538149,1538149:4,The prices are wonderfully low.,the prices are wonderfully low,0.4215,null,restaurant prices,4,positive
1538149,1538149:5,Very good wine choices.,very good wine choices,0.4927,wine choices,drinks style options,4,positive
1543345,1543345:1,Who has room for Cheesesticks with the best pizza in NYC!,who has room for cheesesticks with the best pizza in nyc,0.6696,pizza,food quality,4,positive
1543345,1543345:2,Get the pepperoni - YUM - and a family style salad.,get the pepperoni yum and a family style salad,0.0,pepperoni,food quality,4,positive
1543345,1543345:2,Get the pepperoni - YUM - and a family style salad.,get the pepperoni yum and a family style salad,0.0,family style salad,food quality,4,positive
1543345,1543345:3,Great staff.,great staff,0.6249,staff,service general,4,positive
1543345,1543345:4,Always great service!,always great service,0.6588,service,service general,4,positive
1543345,1543345:5,I go twice a month!,i go twice a month,0.0,null,restaurant general,4,positive
1543345,1543345:6,Fantastic!,fantastic,0.5983,null,restaurant general,4,positive
1561259,1561259:0,"The food is good, I can't lie.",the food is good i can t lie,0.4404,food,food quality,4,positive
1561259,1561259:1,But the staff was so horrible to us.,but the staff was so horrible to us,-0.804,staff,service general,4,negative
1561259,1561259:2,The hostess and the waitress were incredibly rude and did everything they could to rush us out.,the hostess and the waitress were incredibly rude and did everything they could to rush us out,-0.5095,hostess,service general,4,negative
1561259,1561259:2,The hostess and the waitress were incredibly rude and did everything they could to rush us out.,the hostess and the waitress were incredibly rude and did everything they could to rush us out,-0.5095,waitress,service general,4,negative
1561259,1561259:3,We were planning to get dessert but the waitress basically through the bill at us before we had a chance to order.,we were planning to get dessert but the waitress basically through the bill at us before we had a chance to order,0.3612,waitress,service general,4,negative
1561259,1561259:4,"This place is pricey, and yes, the food is worth it; but the service makes you feel like you should be paying a quater of the price.",this place is pricey and yes the food is worth it but the service makes you feel like you should be paying a quater of the price,0.6757,place,restaurant prices,4,negative
1561259,1561259:4,"This place is pricey, and yes, the food is worth it; but the service makes you feel like you should be paying a quater of the price.",this place is pricey and yes the food is worth it but the service makes you feel like you should be paying a quater of the price,0.6757,food,food quality,4,positive
1561259,1561259:4,"This place is pricey, and yes, the food is worth it; but the service makes you feel like you should be paying a quater of the price.",this place is pricey and yes the food is worth it but the service makes you feel like you should be paying a quater of the price,0.6757,service,service general,4,negative
1561259,1561259:5,Save yourself the time and trouble and skip this one!,save yourself the time and trouble and skip this one,0.2003,null,restaurant general,4,negative
