reviewID,sentenceID,sentenceText,processedText,sentimentScore,target,category,part,polarity
BzG#4,BzG#4:3,"All the various Greek and Cypriot dishes are excellent, but the gyro is the reason to come--if you don't eat one your trip was wasted.",all the various greek and cypriot dishes are excellent but the gyro is the reason to come if you don t eat one your trip was wasted,-0.4497,gyro,food quality,9,positive
NP#10,NP#10:0,Best restaurant in Brooklyn,best restaurant in brooklyn,0.6369,restaurant,restaurant general,9,positive
NP#10,NP#10:1,The best!,the best,0.6696,null,restaurant general,9,positive
NP#10,NP#10:2,"Great food, amazing service, this place is a class act.",great food amazing service this place is a class act,0.836,food,food quality,9,positive
NP#10,NP#10:2,"Great food, amazing service, this place is a class act.",great food amazing service this place is a class act,0.836,service,service general,9,positive
NP#10,NP#10:2,"Great food, amazing service, this place is a class act.",great food amazing service this place is a class act,0.836,place,restaurant general,9,positive
NP#10,NP#10:3,The veal was incredible last night.,the veal was incredible last night,0.0,veal,food quality,9,positive
NP#10,NP#10:4,"Fresh, mind blowing flavors.",fresh mind blowing flavors,0.3182,null,food quality,9,positive
NP#10,NP#10:5,This place is a must visit!,this place is a must visit,0.0,place,restaurant general,9,positive
BHD#2,BHD#2:2,"Delicious, creative and fun.",delicious creative and fun,0.872,null,food quality,9,positive
BHD#2,BHD#2:2,"Delicious, creative and fun.",delicious creative and fun,0.872,null,food style options,9,positive
Z#11,Z#11:0,Got a date? Go here!,got a date go here,0.0,null,restaurant miscellaneous,9,positive
Z#11,Z#11:1,Every time I have a special occasion with my boyfriend I have a hard time going anywhere else.,every time i have a special occasion with my boyfriend i have a hard time going anywhere else,0.3182,null,restaurant miscellaneous,9,positive
Z#11,Z#11:2,It is so romantic.,it is so romantic,0.541,null,ambience general,9,positive
Z#11,Z#11:3,"Its dark, and cozy.. there is always jazz music playing when we go.",its dark and cozy there is always jazz music playing when we go,0.2023,null,ambience general,9,positive
Z#11,Z#11:4,Most of the booths allow you to sit next to eachother without looking like 'that' couple.,most of the booths allow you to sit next to eachother without looking like that couple,-0.0541,booths,ambience general,9,positive
Z#11,Z#11:5,The food is all shared so we get to order together and eat together.,the food is all shared so we get to order together and eat together,0.34,food,food style options,9,positive
Z#11,Z#11:6,I've enjoyed 99% of the dishes we've ordered with the only exceptions being the occasional too-authentic-for-me dish (I'm a daring eater but not THAT daring).,i ve enjoyed 99 of the dishes we ve ordered with the only exceptions being the occasional too authentic for me dish i m a daring eater but not that daring,0.4404,dishes,food quality,9,positive
Z#11,Z#11:6,I've enjoyed 99% of the dishes we've ordered with the only exceptions being the occasional too-authentic-for-me dish (I'm a daring eater but not THAT daring).,i ve enjoyed 99 of the dishes we ve ordered with the only exceptions being the occasional too authentic for me dish i m a daring eater but not that daring,0.4404,dish,food quality,9,negative
Z#11,Z#11:7,Once you try it for a special occasion beware.. you can't stop!,once you try it for a special occasion beware you can t stop,0.5967,null,restaurant miscellaneous,9,positive
Z#11,Z#11:8,"You'll be ther for every anniversary, birthday, valentines day...",you ll be ther for every anniversary birthday valentines day,0.0,null,restaurant miscellaneous,9,positive
WE#4,WE#4:0,For a Fabulous Wedding!,for a fabulous wedding,0.5707,null,restaurant miscellaneous,9,positive
WE#4,WE#4:1,My daughter's wedding reception at Water's Edge received the highest compliments from our guests.,my daughter s wedding reception at water s edge received the highest compliments from our guests,0.4019,water s edge,restaurant miscellaneous,9,positive
WE#4,WE#4:2,Everyone raved about the atmosphere (elegant rooms and absolutely incomparable views) and the fabulous food!,everyone raved about the atmosphere elegant rooms and absolutely incomparable views and the fabulous food,0.5707,atmosphere,ambience general,9,positive
WE#4,WE#4:2,Everyone raved about the atmosphere (elegant rooms and absolutely incomparable views) and the fabulous food!,everyone raved about the atmosphere elegant rooms and absolutely incomparable views and the fabulous food,0.5707,rooms,ambience general,9,positive
WE#4,WE#4:2,Everyone raved about the atmosphere (elegant rooms and absolutely incomparable views) and the fabulous food!,everyone raved about the atmosphere elegant rooms and absolutely incomparable views and the fabulous food,0.5707,views,location general,9,positive
WE#4,WE#4:2,Everyone raved about the atmosphere (elegant rooms and absolutely incomparable views) and the fabulous food!,everyone raved about the atmosphere elegant rooms and absolutely incomparable views and the fabulous food,0.5707,food,food quality,9,positive
WE#4,WE#4:3,Service was wonderful;,service was wonderful,0.5719,service,service general,9,positive
WE#4,WE#4:4,everyone was cheerfully cooperative and helpful.,everyone was cheerfully cooperative and helpful,0.7096,null,service general,9,positive
WE#4,WE#4:5,"Paul, the maitre d', was totally professional and always on top of things.",paul the maitre d was totally professional and always on top of things,0.2023,paul,service general,9,positive
WE#4,WE#4:6,Thank you everyone at Water's Edge.,thank you everyone at water s edge,0.3612,water s edge,restaurant general,9,positive
TR#2,TR#2:0,would NOT go back.,would not go back,0.0,null,restaurant general,9,negative
TR#2,TR#2:1,"Service ok but unfriendly,filthy bathroom.",service ok but unfriendly filthy bathroom,0.1531,service,service general,9,negative
TR#2,TR#2:1,"Service ok but unfriendly,filthy bathroom.",service ok but unfriendly filthy bathroom,0.1531,bathroom,ambience general,9,negative
TR#2,TR#2:2,The high prices you're going to pay is for the view not for the food.,the high prices you re going to pay is for the view not for the food,-0.1027,view,location general,9,neutral
TR#2,TR#2:2,The high prices you're going to pay is for the view not for the food.,the high prices you re going to pay is for the view not for the food,-0.1027,food,food quality,9,negative
TR#2,TR#2:2,The high prices you're going to pay is for the view not for the food.,the high prices you re going to pay is for the view not for the food,-0.1027,null,restaurant prices,9,negative
TR#2,TR#2:3,"The bar drinks were Eh, ok to say the least.",the bar drinks were eh ok to say the least,0.296,bar drinks,drinks quality,9,negative
TR#2,TR#2:4,The stuff tilapia was horrid...tasted like cardboard.,the stuff tilapia was horrid tasted like cardboard,0.3612,stuff tilapia,food quality,9,negative
TR#2,TR#2:5,"We thought the dessert would be better, Wrong!",we thought the dessert would be better wrong,-0.126,dessert,food quality,9,negative
TR#2,TR#2:6,$170 down the toilet...,170 down the toilet,0.0,null,restaurant general,9,negative
TR#2,TR#2:6,$170 down the toilet...,170 down the toilet,0.0,null,restaurant prices,9,negative
TR#2,TR#2:7,"oh speaking of bathroom , the mens bathroom was disgusting.",oh speaking of bathroom the mens bathroom was disgusting,-0.5267,mens bathroom,ambience general,9,negative
TR#2,TR#2:8,"The floor was wet, the trash can filled with hand towels n all over the floor, no soap, and no hand towels left.",the floor was wet the trash can filled with hand towels n all over the floor no soap and no hand towels left,0.4588,null,ambience general,9,negative
TFS#10,TFS#10:0,Good Experience,good experience,0.4404,null,restaurant general,9,positive
TFS#10,TFS#10:2,The wine list was extensive - though the staff did not seem knowledgeable about wine pairings.,the wine list was extensive though the staff did not seem knowledgeable about wine pairings,0.0,wine list,drinks style options,9,positive
TFS#10,TFS#10:2,The wine list was extensive - though the staff did not seem knowledgeable about wine pairings.,the wine list was extensive though the staff did not seem knowledgeable about wine pairings,0.0,staff,service general,9,negative
TFS#10,TFS#10:3,"The bread we received was horrible - rock hard and cold - and the ""free"" appetizer of olives was disappointing.",the bread we received was horrible rock hard and cold and the free appetizer of olives was disappointing,-0.7964,bread,food quality,9,negative
TFS#10,TFS#10:3,"The bread we received was horrible - rock hard and cold - and the ""free"" appetizer of olives was disappointing.",the bread we received was horrible rock hard and cold and the free appetizer of olives was disappointing,-0.7964,appetizer of olives,food quality,9,negative
TFS#10,TFS#10:4,"However, our main course was wonderful.",however our main course was wonderful,0.5719,main course,food quality,9,positive
TFS#10,TFS#10:5,I had fish and my husband had the filet - both of which exceeded our expectations.,i had fish and my husband had the filet both of which exceeded our expectations,0.0,fish,food quality,9,positive
TFS#10,TFS#10:5,I had fish and my husband had the filet - both of which exceeded our expectations.,i had fish and my husband had the filet both of which exceeded our expectations,0.0,filet,food quality,9,positive
TFS#10,TFS#10:6,"The dessert (we had a pear torte) was good - but, once again, the staff was unable to provide appropriate drink suggestions.",the dessert we had a pear torte was good but once again the staff was unable to provide appropriate drink suggestions,0.2382,pear torte,food quality,9,positive
TFS#10,TFS#10:6,"The dessert (we had a pear torte) was good - but, once again, the staff was unable to provide appropriate drink suggestions.",the dessert we had a pear torte was good but once again the staff was unable to provide appropriate drink suggestions,0.2382,staff,service general,9,negative
TFS#10,TFS#10:7,When we inquired about ports - the waitress listed off several but did not know taste variations or cost.,when we inquired about ports the waitress listed off several but did not know taste variations or cost,0.0,waitress,service general,9,negative
TFS#10,TFS#10:8,Not what I would expect for the price and prestige of this location.,not what i would expect for the price and prestige of this location,0.0,null,service general,9,negative
TFS#10,TFS#10:8,Not what I would expect for the price and prestige of this location.,not what i would expect for the price and prestige of this location,0.0,location,restaurant prices,9,neutral
TFS#10,TFS#10:8,Not what I would expect for the price and prestige of this location.,not what i would expect for the price and prestige of this location,0.0,location,restaurant miscellaneous,9,neutral
TFS#10,TFS#10:9,"All in all, I would return - as it was a beautiful restaurant - but I hope the staff pays more attention to the little details in the future.",all in all i would return as it was a beautiful restaurant but i hope the staff pays more attention to the little details in the future,0.743,restaurant,restaurant general,9,positive
TFS#10,TFS#10:9,"All in all, I would return - as it was a beautiful restaurant - but I hope the staff pays more attention to the little details in the future.",all in all i would return as it was a beautiful restaurant but i hope the staff pays more attention to the little details in the future,0.743,restaurant,ambience general,9,positive
TFS#10,TFS#10:9,"All in all, I would return - as it was a beautiful restaurant - but I hope the staff pays more attention to the little details in the future.",all in all i would return as it was a beautiful restaurant but i hope the staff pays more attention to the little details in the future,0.743,staff,service general,9,negative
Z#9,Z#9:0,"short and sweet  seating is great:it's romantic,cozy and private.",short and sweet  seating is great it s romantic cozy and private,0.4588,seating,ambience general,9,positive
Z#9,Z#9:1,The boths are not as small as some of the reviews make them out to look they're perfect for 2 people.,the boths are not as small as some of the reviews make them out to look they re perfect for 2 people,0.5719,boths,ambience general,9,positive
Z#9,Z#9:2,The service was extremely fast and attentive(thanks to the service button on your table) but I barely understood 1 word when the waiter took our order.,the service was extremely fast and attentive thanks to the service button on your table but i barely understood 1 word when the waiter took our order,0.0,service,service general,9,positive
Z#9,Z#9:2,The service was extremely fast and attentive(thanks to the service button on your table) but I barely understood 1 word when the waiter took our order.,the service was extremely fast and attentive thanks to the service button on your table but i barely understood 1 word when the waiter took our order,0.0,service button,service general,9,positive
Z#9,Z#9:2,The service was extremely fast and attentive(thanks to the service button on your table) but I barely understood 1 word when the waiter took our order.,the service was extremely fast and attentive thanks to the service button on your table but i barely understood 1 word when the waiter took our order,0.0,waiter,service general,9,negative
Z#9,Z#9:3,The food was ok and fair nothing to go crazy.,the food was ok and fair nothing to go crazy,0.6742,food,food quality,9,neutral
Z#9,Z#9:5,Over all the looks of the place exceeds the actual meals.,over all the looks of the place exceeds the actual meals,0.0,looks,ambience general,9,positive
Z#9,Z#9:5,Over all the looks of the place exceeds the actual meals.,over all the looks of the place exceeds the actual meals,0.0,meals,food quality,9,negative
Z#9,Z#9:6,So what you really end up paying for is the restaurant not the food.,so what you really end up paying for is the restaurant not the food,0.0,restaurant,restaurant prices,9,negative
Z#9,Z#9:6,So what you really end up paying for is the restaurant not the food.,so what you really end up paying for is the restaurant not the food,0.0,restaurant,ambience general,9,neutral
Z#9,Z#9:6,So what you really end up paying for is the restaurant not the food.,so what you really end up paying for is the restaurant not the food,0.0,food,food quality,9,negative
Z#9,Z#9:7,Will prob. not return but it is a great dinning experience to try atleast once.,will prob not return but it is a great dinning experience to try atleast once,0.7684,null,restaurant general,9,negative
Z#9,Z#9:7,Will prob. not return but it is a great dinning experience to try atleast once.,will prob not return but it is a great dinning experience to try atleast once,0.7684,null,restaurant general,9,positive
NP#3,NP#3:0,Impressed...,impressed,0.0,null,restaurant general,9,positive
NP#3,NP#3:1,Subtle food and service,subtle food and service,0.0,food,food quality,9,positive
NP#3,NP#3:1,Subtle food and service,subtle food and service,0.0,service,service general,9,positive
NP#3,NP#3:2,Noodle pudding is exactly the type of service and food I enjoy.,noodle pudding is exactly the type of service and food i enjoy,0.4939,service,service general,9,positive
NP#3,NP#3:2,Noodle pudding is exactly the type of service and food I enjoy.,noodle pudding is exactly the type of service and food i enjoy,0.4939,food,food quality,9,positive
NP#3,NP#3:3,"Servers are all different, Greg is my favorite.",servers are all different greg is my favorite,0.4588,greg,service general,9,positive
NP#3,NP#3:4,"Sometimes tables don't understand his sense of humor but it's refreshing to have a server who has personality, professionalism, and respects the privacy of your dinner.",sometimes tables don t understand his sense of humor but it s refreshing to have a server who has personality professionalism and respects the privacy of your dinner,0.5423,server,service general,9,positive
NP#3,NP#3:5,This is the first place I've been that a runner remembers my order... hope he likes his job because I have half a mind to steal him for my restaurant.,this is the first place i ve been that a runner remembers my order hope he likes his job because i have half a mind to steal him for my restaurant,0.3612,runner,service general,9,positive
NP#3,NP#3:6,Prices are fair across the board for both food and bev.,prices are fair across the board for both food and bev,0.3182,food,food prices,9,positive
NP#3,NP#3:6,Prices are fair across the board for both food and bev.,prices are fair across the board for both food and bev,0.3182,bev,drinks prices,9,positive
NP#3,NP#3:7,"I go out to eat and like my courses, servers are patient and never rush courses or force another drink.",i go out to eat and like my courses servers are patient and never rush courses or force another drink,0.3612,servers,service general,9,positive
BHD#7,BHD#7:0,amazing fresh dogs but best of all endless toppings!!!,amazing fresh dogs but best of all endless toppings,0.894,dogs,food quality,9,positive
BHD#7,BHD#7:0,amazing fresh dogs but best of all endless toppings!!!,amazing fresh dogs but best of all endless toppings,0.894,toppings,food style options,9,positive
BHD#7,BHD#7:1,this place had ALL the trimmings and i mean all.,this place had all the trimmings and i mean all,0.0,trimmings,food style options,9,positive
BHD#7,BHD#7:2,"peppers, onions, relish, chilli, cheeses, you NAME it.",peppers onions relish chilli cheeses you name it,0.0,null,food style options,9,positive
BHD#7,BHD#7:3,amazing fun for hot dog lovers of all ages PLEASE do yourself a favor and check this place out!!!!,amazing fun for hot dog lovers of all ages please do yourself a favor and check this place out,0.9545,place,restaurant general,9,positive
BHD#7,BHD#7:3,amazing fun for hot dog lovers of all ages PLEASE do yourself a favor and check this place out!!!!,amazing fun for hot dog lovers of all ages please do yourself a favor and check this place out,0.9545,hot dog,food quality,9,positive
CLF#5,CLF#5:0,BEST DINING EXPERIENCE IN THE WEST VILLAGE!,best dining experience in the west village,0.6696,null,restaurant general,9,positive
CLF#5,CLF#5:1,Stepping into Casa La Femme last night was a true experience unlike any other in New York!,stepping into casa la femme last night was a true experience unlike any other in new york,0.4753,casa la femme,restaurant general,9,positive
CLF#5,CLF#5:2,Highly impressed from the decor to the food to the hospitality to the great night I had!,highly impressed from the decor to the food to the hospitality to the great night i had,0.831,decor,ambience general,9,positive
CLF#5,CLF#5:2,Highly impressed from the decor to the food to the hospitality to the great night I had!,highly impressed from the decor to the food to the hospitality to the great night i had,0.831,food,food quality,9,positive
CLF#5,CLF#5:2,Highly impressed from the decor to the food to the hospitality to the great night I had!,highly impressed from the decor to the food to the hospitality to the great night i had,0.831,null,service general,9,positive
CLF#5,CLF#5:2,Highly impressed from the decor to the food to the hospitality to the great night I had!,highly impressed from the decor to the food to the hospitality to the great night i had,0.831,null,restaurant general,9,positive
CLF#5,CLF#5:3,The have a great cocktail with Citrus Vodka and lemon and lime juice and mint leaves that is to die for!,the have a great cocktail with citrus vodka and lemon and lime juice and mint leaves that is to die for,0.126,cocktail with citrus vodka and lemon and lime juice and mint leaves,drinks quality,9,positive
CLF#5,CLF#5:4,"Food took some time to prepare, all worth waiting for.",food took some time to prepare all worth waiting for,0.2263,food,food quality,9,positive
CLF#5,CLF#5:4,"Food took some time to prepare, all worth waiting for.",food took some time to prepare all worth waiting for,0.2263,null,service general,9,neutral
CLF#5,CLF#5:5,We were drawn into the belly dancing show that captivated the crowd.,we were drawn into the belly dancing show that captivated the crowd,0.3818,belly dancing show,ambience general,9,positive
CLF#5,CLF#5:6,I never write on these sites but this restaurant is def worth commending!,i never write on these sites but this restaurant is def worth commending,0.3903,restaurant,restaurant general,9,positive
CLF#5,CLF#5:7,Great find in the West Village!,great find in the west village,0.6588,null,restaurant general,9,positive
NP#4,NP#4:0,Maggot in the food!,maggot in the food,0.0,food,food quality,9,negative
NP#4,NP#4:2,"The menu looked great, and the waiter was very nice, but when the food came, it was average.",the menu looked great and the waiter was very nice but when the food came it was average,0.5569,menu,food style options,9,positive
NP#4,NP#4:2,"The menu looked great, and the waiter was very nice, but when the food came, it was average.",the menu looked great and the waiter was very nice but when the food came it was average,0.5569,waiter,service general,9,positive
NP#4,NP#4:2,"The menu looked great, and the waiter was very nice, but when the food came, it was average.",the menu looked great and the waiter was very nice but when the food came it was average,0.5569,food,food quality,9,neutral
NP#4,NP#4:3,"Nevertheless, I finished my plate, and that's when I found a maggot in mushroom sauce at the bottom.",nevertheless i finished my plate and that s when i found a maggot in mushroom sauce at the bottom,0.0,mushroom sauce,food quality,9,negative
NP#4,NP#4:4,"I showed it to the manager, and he smilingly apologized and brought us two free desserts (but did not ask us what we wanted and so brought the last two desserts we would have asked for).",i showed it to the manager and he smilingly apologized and brought us two free desserts but did not ask us what we wanted and so brought the last two desserts we would have asked for,0.836,manager,service general,9,positive
NP#4,NP#4:4,"I showed it to the manager, and he smilingly apologized and brought us two free desserts (but did not ask us what we wanted and so brought the last two desserts we would have asked for).",i showed it to the manager and he smilingly apologized and brought us two free desserts but did not ask us what we wanted and so brought the last two desserts we would have asked for,0.836,manager,service general,9,negative
NP#4,NP#4:5,"When the bill came, nothing was comped, so I told the manager very politely that we were willing to pay for the wine, but I didn't think I should have to pay for food with a maggot in it.",when the bill came nothing was comped so i told the manager very politely that we were willing to pay for the wine but i didn t think i should have to pay for food with a maggot in it,-0.2023,null,service general,9,negative
NP#4,NP#4:7,"The manager finally said he would comp the two glasses of wine (which cost less than the food), and made it seem like a big concession.",the manager finally said he would comp the two glasses of wine which cost less than the food and made it seem like a big concession,0.3612,manager,service general,9,negative
NP#4,NP#4:8,We paid and left because we didn't feel like arguing any more.,we paid and left because we didn t feel like arguing any more,0.0951,null,service general,9,negative
NP#4,NP#4:9,"I have worked in restaurants and cook a lot, and there is no way a maggot should be able to get into well prepared food.",i have worked in restaurants and cook a lot and there is no way a maggot should be able to get into well prepared food,0.2023,food,food quality,9,negative
NP#4,NP#4:10,"For a restaurant with such a good reputation and that is usually so packed, there was no reason for such a lack of intelligent customer service.",for a restaurant with such a good reputation and that is usually so packed there was no reason for such a lack of intelligent customer service,0.34,restaurant,restaurant miscellaneous,9,positive
NP#4,NP#4:10,"For a restaurant with such a good reputation and that is usually so packed, there was no reason for such a lack of intelligent customer service.",for a restaurant with such a good reputation and that is usually so packed there was no reason for such a lack of intelligent customer service,0.34,customer service,service general,9,negative
P#6,P#6:0,Unhygienic,unhygienic,0.0,null,food quality,9,negative
P#6,P#6:1,I do not recommend.,i do not recommend,-0.2755,null,restaurant general,9,negative
P#6,P#6:3,I got hair in my food 2 times of then !,i got hair in my food 2 times of then,0.0,food,food quality,9,negative
BzG#2,BzG#2:0,"Great place, great value.",great place great value,0.891,place,restaurant general,9,positive
BzG#2,BzG#2:0,"Great place, great value.",great place great value,0.891,place,restaurant prices,9,positive
BzG#2,BzG#2:1,"The food is flavorful, plentiful and reasonably priced.",the food is flavorful plentiful and reasonably priced,0.0,food,food quality,9,positive
BzG#2,BzG#2:1,"The food is flavorful, plentiful and reasonably priced.",the food is flavorful plentiful and reasonably priced,0.0,food,food style options,9,positive
BzG#2,BzG#2:1,"The food is flavorful, plentiful and reasonably priced.",the food is flavorful plentiful and reasonably priced,0.0,food,food prices,9,positive
BzG#2,BzG#2:2,The atmosphere is relaxed and casual.,the atmosphere is relaxed and casual,0.6124,atmosphere,ambience general,9,positive
BzG#2,BzG#2:3,It's a great place to order from or sit-in.,it s a great place to order from or sit in,0.6249,place,restaurant miscellaneous,9,positive
TVU#4,TVU#4:0,Awesome,awesome,0.6249,null,restaurant general,9,positive
TVU#4,TVU#4:1,"Inexpensive, unassuming, great time!",inexpensive unassuming great time,0.6588,null,restaurant prices,9,positive
