reviewID,sentenceID,sentenceText,processedText,sentimentScore,target,category,part,polarity
496132,496132:2,Prices are very good.,prices are very good,0.4927,null,restaurant prices,6,positive
496132,496132:3,The food is excellent! ,the food is excellent,0.6114,food,food quality,6,positive
496132,496132:4,"if you're daring, try the balsamic vinegar over icecream, it's wonderful!",if you re daring try the balsamic vinegar over icecream it s wonderful,0.7574,balsamic vinegar over icecream,food quality,6,positive
498657,498657:0,"Do not get the Go Go Hamburgers, no matter what the reviews say.",do not get the go go hamburgers no matter what the reviews say,-0.2732,go go hamburgers,food quality,6,negative
498657,498657:1,They were such a rip-off ($8.95 for four small meat patties in steamed buns) and not worth trying.,they were such a rip off 8 95 for four small meat patties in steamed buns and not worth trying,-0.1695,null,food quality,6,negative
498657,498657:1,They were such a rip-off ($8.95 for four small meat patties in steamed buns) and not worth trying.,they were such a rip off 8 95 for four small meat patties in steamed buns and not worth trying,-0.1695,null,food style options,6,negative
498657,498657:1,They were such a rip-off ($8.95 for four small meat patties in steamed buns) and not worth trying.,they were such a rip off 8 95 for four small meat patties in steamed buns and not worth trying,-0.1695,null,food prices,6,negative
498657,498657:2,"The rest of the dim sum, though pricey by Chinatown standards, is worth it.",the rest of the dim sum though pricey by chinatown standards is worth it,0.2263,dim sum,food prices,6,negative
498657,498657:2,"The rest of the dim sum, though pricey by Chinatown standards, is worth it.",the rest of the dim sum though pricey by chinatown standards is worth it,0.2263,dim sum,food quality,6,positive
498657,498657:3,Steamed fresh so brought hot hot hot to your table.,steamed fresh so brought hot hot hot to your table,0.3182,null,food quality,6,positive
498657,498657:4,"The wait here is long for dim sum, but if you don't like sharing tables or if the typical raucous dim sum atmosphere is not your gig, this is a sleek (for Chinatown) alternative.",the wait here is long for dim sum but if you don t like sharing tables or if the typical raucous dim sum atmosphere is not your gig this is a sleek for chinatown alternative,-0.6871,wait,service general,6,negative
498657,498657:4,"The wait here is long for dim sum, but if you don't like sharing tables or if the typical raucous dim sum atmosphere is not your gig, this is a sleek (for Chinatown) alternative.",the wait here is long for dim sum but if you don t like sharing tables or if the typical raucous dim sum atmosphere is not your gig this is a sleek for chinatown alternative,-0.6871,atmosphere,ambience general,6,negative
498657,498657:4,"The wait here is long for dim sum, but if you don't like sharing tables or if the typical raucous dim sum atmosphere is not your gig, this is a sleek (for Chinatown) alternative.",the wait here is long for dim sum but if you don t like sharing tables or if the typical raucous dim sum atmosphere is not your gig this is a sleek for chinatown alternative,-0.6871,null,restaurant miscellaneous,6,negative
498657,498657:5,"A few tips: skip the turnip cake, roast pork buns and egg custards.",a few tips skip the turnip cake roast pork buns and egg custards,0.0,turnip cake,food quality,6,negative
498657,498657:5,"A few tips: skip the turnip cake, roast pork buns and egg custards.",a few tips skip the turnip cake roast pork buns and egg custards,0.0,roast pork buns,food quality,6,negative
498657,498657:5,"A few tips: skip the turnip cake, roast pork buns and egg custards.",a few tips skip the turnip cake roast pork buns and egg custards,0.0,egg custards,food quality,6,negative
498657,498657:6,These are overpriced and you can get better just around the corner:,these are overpriced and you can get better just around the corner,0.4404,null,food prices,6,negative
498657,498657:6,These are overpriced and you can get better just around the corner:,these are overpriced and you can get better just around the corner,0.4404,null,food quality,6,negative
503807,503807:1,I was pleasantly suprised.,i was pleasantly suprised,0.4767,null,restaurant general,6,positive
503807,503807:2,The food was exceptional.,the food was exceptional,0.0,food,food quality,6,positive
503807,503807:4,"I choose to go with one of the special, the braised lamb shank in red wine, which was excellent.",i choose to go with one of the special the braised lamb shank in red wine which was excellent,0.7506,braised lamb shank in red wine,food quality,6,positive
503807,503807:5,The service was friendly and the atmosphere was casual.,the service was friendly and the atmosphere was casual,0.6124,service,service general,6,positive
503807,503807:5,The service was friendly and the atmosphere was casual.,the service was friendly and the atmosphere was casual,0.6124,atmosphere,ambience general,6,neutral
503807,503807:6,The restaurant is a bit noisy but that is something that can be overlooked once you sit down and enjoy a great meal,the restaurant is a bit noisy but that is something that can be overlooked once you sit down and enjoy a great meal,0.8873,meal,food quality,6,positive
503807,503807:6,The restaurant is a bit noisy but that is something that can be overlooked once you sit down and enjoy a great meal,the restaurant is a bit noisy but that is something that can be overlooked once you sit down and enjoy a great meal,0.8873,restaurant,ambience general,6,neutral
505535,505535:0,this little place has a cute interior decor and affordable city prices.,this little place has a cute interior decor and affordable city prices,0.4091,interior decor,ambience general,6,positive
505535,505535:0,this little place has a cute interior decor and affordable city prices.,this little place has a cute interior decor and affordable city prices,0.4091,place,restaurant prices,6,positive
505535,505535:1,"the pad se ew chicken was delicious, however the pad thai was far too oily.",the pad se ew chicken was delicious however the pad thai was far too oily,0.5719,pad se ew chicken,food quality,6,positive
505535,505535:1,"the pad se ew chicken was delicious, however the pad thai was far too oily.",the pad se ew chicken was delicious however the pad thai was far too oily,0.5719,pad thai,food quality,6,negative
507755,507755:0,"Have eaten at Ginger House several times, and it's always good.",have eaten at ginger house several times and it s always good,0.4404,ginger house,restaurant general,6,positive
507755,507755:1,The fried dumplings are GREAT!,the fried dumplings are great,0.7027,fried dumplings,food quality,6,positive
507755,507755:2,Finally a reliable Chinese restaurant!,finally a reliable chinese restaurant,0.0,chinese restaurant,restaurant general,6,positive
507844,507844:0,This place would be so much better served by being run by a group that actually understands customer service.,this place would be so much better served by being run by a group that actually understands customer service,0.4902,customer service,service general,6,negative
507844,507844:1,"The only thing you can do here is walk in and eat .. but planning an event, especially a small, intimate one, forget about it.",the only thing you can do here is walk in and eat but planning an event especially a small intimate one forget about it,-0.3291,null,restaurant miscellaneous,6,negative
507844,507844:2,"They are not helpful in the least and will give you the grand run around so by the time the event date rolls around you will not only regret chosing this place, but also become hostile!",they are not helpful in the least and will give you the grand run around so by the time the event date rolls around you will not only regret chosing this place but also become hostile,-0.4003,null,service general,6,negative
507844,507844:3,"Nobody at this restaurant will give firm answers about anything and in the end, not one person takes responsibility for anything.",nobody at this restaurant will give firm answers about anything and in the end not one person takes responsibility for anything,0.0,null,service general,6,negative
507844,507844:4,"Terrible, terrible management - deserves to be shut-down.",terrible terrible management deserves to be shut down,-0.7351,management,service general,6,negative
507844,507844:4,"Terrible, terrible management - deserves to be shut-down.",terrible terrible management deserves to be shut down,-0.7351,null,restaurant general,6,negative
507937,507937:0,Never fails to please.,never fails to please,0.0951,null,restaurant general,6,positive
507937,507937:1,"delicious bagels, especially when right out of the oven.",delicious bagels especially when right out of the oven,0.5719,bagels,food quality,6,positive
507937,507937:2,Spreads and toppings are great - though a bit pricey.,spreads and toppings are great though a bit pricey,0.6249,spreads,food quality,6,positive
507937,507937:2,Spreads and toppings are great - though a bit pricey.,spreads and toppings are great though a bit pricey,0.6249,toppings,food quality,6,positive
507937,507937:2,Spreads and toppings are great - though a bit pricey.,spreads and toppings are great though a bit pricey,0.6249,spreads,food prices,6,negative
507937,507937:2,Spreads and toppings are great - though a bit pricey.,spreads and toppings are great though a bit pricey,0.6249,toppings,food prices,6,negative
507937,507937:3,Service is fast and friendly.,service is fast and friendly,0.4939,service,service general,6,positive
507937,507937:4,"Only drawback - they won't toast your bagel, and they don't make eggs for the bagel.",only drawback they won t toast your bagel and they don t make eggs for the bagel,0.0,null,service general,6,negative
507937,507937:5,But that is highly forgivable.,but that is highly forgivable,0.611,null,service general,6,positive
509227,509227:0,"Been there, done that, and New York, it's not that big a deal.",been there done that and new york it s not that big a deal,0.0,null,restaurant general,6,neutral
509227,509227:1,"The food is decent at best, and the ambience, well, it's a matter of opinion, some may consider it to be a sweet thing, I thought it was just annoying.",the food is decent at best and the ambience well it s a matter of opinion some may consider it to be a sweet thing i thought it was just annoying,0.7717,food,food quality,6,negative
509227,509227:1,"The food is decent at best, and the ambience, well, it's a matter of opinion, some may consider it to be a sweet thing, I thought it was just annoying.",the food is decent at best and the ambience well it s a matter of opinion some may consider it to be a sweet thing i thought it was just annoying,0.7717,ambience,ambience general,6,negative
509227,509227:2,"If celebrities make you sweat, then your in for a ride, but if your like most around these parts then you'll just yawn and wonder whats with all the hype.",if celebrities make you sweat then your in for a ride but if your like most around these parts then you ll just yawn and wonder whats with all the hype,0.5023,null,restaurant miscellaneous,6,negative
509227,509227:3,"Rao is a good restaurant, but it's nothing special.",rao is a good restaurant but it s nothing special,-0.2351,rao,restaurant general,6,neutral
511290,511290:1,"But after last night, Spice Grill is the only place I'm eating indian cuisine.",but after last night spice grill is the only place i m eating indian cuisine,0.0,indian cuisine,food quality,6,positive
511290,511290:2,You must try the shrimp appetizers.,you must try the shrimp appetizers,0.0,shrimp appetizers,food quality,6,positive
511290,511290:3,Even my Indian friend couldn't believe how good and tasty everything was.,even my indian friend couldn t believe how good and tasty everything was,0.2008,null,food quality,6,positive
511290,511290:4,This place has the the correct ambience and an excellent staff to make you feel like a guest and a friend at the same time.,this place has the the correct ambience and an excellent staff to make you feel like a guest and a friend at the same time,0.8555,ambience,ambience general,6,positive
511290,511290:4,This place has the the correct ambience and an excellent staff to make you feel like a guest and a friend at the same time.,this place has the the correct ambience and an excellent staff to make you feel like a guest and a friend at the same time,0.8555,staff,service general,6,positive
512294,512294:0,"Great food, great prices, great service.",great food great prices great service,0.9231,food,food quality,6,positive
512294,512294:0,"Great food, great prices, great service.",great food great prices great service,0.9231,null,restaurant prices,6,positive
512294,512294:0,"Great food, great prices, great service.",great food great prices great service,0.9231,service,service general,6,positive
512294,512294:1,"If you are looking for a good quality, cheap eats - this is the place.",if you are looking for a good quality cheap eats this is the place,0.4404,eats,food quality,6,positive
512294,512294:1,"If you are looking for a good quality, cheap eats - this is the place.",if you are looking for a good quality cheap eats this is the place,0.4404,eats,food prices,6,positive
512925,512925:0,it's a perfect place to have a amanzing indian food.,it s a perfect place to have a amanzing indian food,0.5719,indian food,food quality,6,positive
512925,512925:1,I really loved the different and inovated touch that's the cheff gives to the food.,i really loved the different and inovated touch that s the cheff gives to the food,0.6361,cheff,food style options,6,positive
512925,512925:2,"also it's great to have dinner in a very romantic and confortable place, the service it's just perfect...they're so frendly that we never want to live the place!",also it s great to have dinner in a very romantic and confortable place the service it s just perfect they re so frendly that we never want to live the place,0.7999,place,ambience general,6,positive
512925,512925:2,"also it's great to have dinner in a very romantic and confortable place, the service it's just perfect...they're so frendly that we never want to live the place!",also it s great to have dinner in a very romantic and confortable place the service it s just perfect they re so frendly that we never want to live the place,0.7999,service,service general,6,positive
513395,513395:1,"Their bagels are fine, but they are a little overcooked, and not really a 'special' bagel experience.",their bagels are fine but they are a little overcooked and not really a special bagel experience,0.1027,bagels,food quality,6,negative
513521,513521:0,Great bagels made the old-fashioned way.,great bagels made the old fashioned way,0.6249,bagels,food quality,6,positive
513521,513521:0,Great bagels made the old-fashioned way.,great bagels made the old fashioned way,0.6249,bagels,food style options,6,positive
513521,513521:2,Drawbacks: service is slow and they don't toast!,drawbacks service is slow and they don t toast,0.0,service,service general,6,negative
519425,519425:0,The food was absolutely amazing!!,the food was absolutely amazing,0.6885,food,food quality,6,positive
519425,519425:1,The baked clams octopus we shared as appetizers were the best we've ever had!! ,the baked clams octopus we shared as appetizers were the best we ve ever had,0.8011,baked clams octopus,food quality,6,positive
519425,519425:2,"The lamb was tender so full of flavor, the dessert was divine!!",the lamb was tender so full of flavor the dessert was divine,0.6351,lamb,food quality,6,positive
519425,519425:2,"The lamb was tender so full of flavor, the dessert was divine!!",the lamb was tender so full of flavor the dessert was divine,0.6351,dessert,food quality,6,positive
519425,519425:3,The waiter was attentive.,the waiter was attentive,0.0,waiter,service general,6,positive
519425,519425:4,The place itself is beautiful the bar scene seems to be happening.,the place itself is beautiful the bar scene seems to be happening,0.5994,place,ambience general,6,positive
519425,519425:4,The place itself is beautiful the bar scene seems to be happening.,the place itself is beautiful the bar scene seems to be happening,0.5994,bar scene,ambience general,6,positive
521916,521916:0,"Downtown Dinner 2002 - Prixe fix: Appetizers were ok, waiter gave me poor suggestion..try the potato stuff kanish best one.",downtown dinner 2002 prixe fix appetizers were ok waiter gave me poor suggestion try the potato stuff kanish best one,0.5106,appetizers,food quality,6,neutral
521916,521916:0,"Downtown Dinner 2002 - Prixe fix: Appetizers were ok, waiter gave me poor suggestion..try the potato stuff kanish best one.",downtown dinner 2002 prixe fix appetizers were ok waiter gave me poor suggestion try the potato stuff kanish best one,0.5106,waiter,service general,6,negative
521916,521916:0,"Downtown Dinner 2002 - Prixe fix: Appetizers were ok, waiter gave me poor suggestion..try the potato stuff kanish best one.",downtown dinner 2002 prixe fix appetizers were ok waiter gave me poor suggestion try the potato stuff kanish best one,0.5106,potato stuff kanish,food quality,6,positive
521916,521916:1,"Small servings for main entree, i had salmon (wasnt impressed) girlfriend had chicken, it was good.",small servings for main entree i had salmon wasnt impressed girlfriend had chicken it was good,0.4404,salmon,food quality,6,negative
521916,521916:1,"Small servings for main entree, i had salmon (wasnt impressed) girlfriend had chicken, it was good.",small servings for main entree i had salmon wasnt impressed girlfriend had chicken it was good,0.4404,chicken,food quality,6,positive
521916,521916:1,"Small servings for main entree, i had salmon (wasnt impressed) girlfriend had chicken, it was good.",small servings for main entree i had salmon wasnt impressed girlfriend had chicken it was good,0.4404,servings for main entree,food style options,6,negative
521916,521916:2,Dessert is a joke...dont bother,dessert is a joke dont bother,-0.34,dessert,food quality,6,negative
527109,527109:0,"Volare virgins or weekly regulars, everyone gets treated the same and you can't ask for more than that when the service is this friendly.",volare virgins or weekly regulars everyone gets treated the same and you can t ask for more than that when the service is this friendly,0.5789,service,service general,6,positive
527109,527109:1,"The restaurant has a Family feel, not least with regard to the portions which are enormous; the veal alone could have single-handedly solved third world famine.",the restaurant has a family feel not least with regard to the portions which are enormous the veal alone could have single handedly solved third world famine,0.0258,feel,ambience general,6,positive
527109,527109:1,"The restaurant has a Family feel, not least with regard to the portions which are enormous; the veal alone could have single-handedly solved third world famine.",the restaurant has a family feel not least with regard to the portions which are enormous the veal alone could have single handedly solved third world famine,0.0258,portions,food style options,6,positive
527109,527109:1,"The restaurant has a Family feel, not least with regard to the portions which are enormous; the veal alone could have single-handedly solved third world famine.",the restaurant has a family feel not least with regard to the portions which are enormous the veal alone could have single handedly solved third world famine,0.0258,veal,food style options,6,positive
527109,527109:2,"The anti-pasta was excellent, especially the calamari, as were the filling pasta mains.",the anti pasta was excellent especially the calamari as were the filling pasta mains,0.5719,anti pasta,food quality,6,positive
527109,527109:2,"The anti-pasta was excellent, especially the calamari, as were the filling pasta mains.",the anti pasta was excellent especially the calamari as were the filling pasta mains,0.5719,calamari,food quality,6,positive
527109,527109:2,"The anti-pasta was excellent, especially the calamari, as were the filling pasta mains.",the anti pasta was excellent especially the calamari as were the filling pasta mains,0.5719,pasta mains,food quality,6,positive
527109,527109:2,"The anti-pasta was excellent, especially the calamari, as were the filling pasta mains.",the anti pasta was excellent especially the calamari as were the filling pasta mains,0.5719,pasta mains,food style options,6,positive
527109,527109:3,The wine list is extensive and can easily hike up an otherwise reasonably priced meal.,the wine list is extensive and can easily hike up an otherwise reasonably priced meal,0.34,wine list,drinks style options,6,positive
527109,527109:3,The wine list is extensive and can easily hike up an otherwise reasonably priced meal.,the wine list is extensive and can easily hike up an otherwise reasonably priced meal,0.34,meal,food prices,6,positive
527109,527109:4,"Still, any quibbles about the bill were off-set by the pour-your-own measures of liquers which were courtesey of the house...",still any quibbles about the bill were off set by the pour your own measures of liquers which were courtesey of the house,0.0,null,restaurant prices,6,neutral
527109,527109:4,"Still, any quibbles about the bill were off-set by the pour-your-own measures of liquers which were courtesey of the house...",still any quibbles about the bill were off set by the pour your own measures of liquers which were courtesey of the house,0.0,measures of liquers,drinks style options,6,positive
528251,528251:0,Fantastic place.,fantastic place,0.5574,place,restaurant general,6,positive
528251,528251:1,Cute and decorative.,cute and decorative,0.4588,null,ambience general,6,positive
528251,528251:2,A pleasant surprise.,a pleasant surprise,0.6597,null,restaurant general,6,positive
528251,528251:3,Go there to relax and feel like your somewhere else.,go there to relax and feel like your somewhere else,0.6597,null,ambience general,6,positive
530517,530517:0,Lucky Strike is a great casual place to just grab a bite to eat.,lucky strike is a great casual place to just grab a bite to eat,0.802,lucky strike,restaurant general,6,positive
530517,530517:2,"Great food, great decor, great service.",great food great decor great service,0.9231,food,food quality,6,positive
530517,530517:2,"Great food, great decor, great service.",great food great decor great service,0.9231,decor,ambience general,6,positive
530517,530517:2,"Great food, great decor, great service.",great food great decor great service,0.9231,service,service general,6,positive
530517,530517:3,I recommend it!,i recommend it,0.4199,null,restaurant general,6,positive
535086,535086:0,"This is the perfect spot for meeting friends, having lunch, dinner, pre-theatre or after-theatre drinks!",this is the perfect spot for meeting friends having lunch dinner pre theatre or after theatre drinks,0.7959,spot,restaurant miscellaneous,6,positive
535086,535086:1,(Always ask the bartender for the SEASONAL beer!!!,always ask the bartender for the seasonal beer,0.0,seasonal beer,drinks quality,6,positive
535086,535086:2,Guaranteed to be a tasty experience!),guaranteed to be a tasty experience,0.0,null,drinks quality,6,positive
535086,535086:3,Excellent spot for holiday get togethers with co-workers or friends that you haven't seen in a while.,excellent spot for holiday get togethers with co workers or friends that you haven t seen in a while,0.8591,spot,restaurant miscellaneous,6,positive
535086,535086:4,I have been doing all of the above at the Heartland Brewery for over 5 years now and I HAVE NEVER BEEN DISAPPOINTED!,i have been doing all of the above at the heartland brewery for over 5 years now and i have never been disappointed,0.5249,heartland brewery,restaurant general,6,positive
535086,535086:5,All the people that I bring there go back on their own and bring THEIR friends!,all the people that i bring there go back on their own and bring their friends,0.5255,null,restaurant miscellaneous,6,positive
535086,535086:6,Go there once and oh yes...you will go back...you will...,go there once and oh yes you will go back you will,0.0,null,restaurant general,6,positive
535171,535171:0,What a great place!,what a great place,0.6588,place,restaurant general,6,positive
535171,535171:1,Not the typical NYC gimmick theme restaurant.,not the typical nyc gimmick theme restaurant,0.0,restaurant,ambience general,6,positive
535171,535171:2,"A cool bar with great food, and tons of excellent beer.",a cool bar with great food and tons of excellent beer,0.8779,bar,ambience general,6,positive
535171,535171:2,"A cool bar with great food, and tons of excellent beer.",a cool bar with great food and tons of excellent beer,0.8779,food,food quality,6,positive
535171,535171:2,"A cool bar with great food, and tons of excellent beer.",a cool bar with great food and tons of excellent beer,0.8779,beer,drinks quality,6,positive
535171,535171:2,"A cool bar with great food, and tons of excellent beer.",a cool bar with great food and tons of excellent beer,0.8779,beer,drinks style options,6,positive
535171,535171:3,And even with it's Pub atmosphere they were great to my kids too!,and even with it s pub atmosphere they were great to my kids too,0.6588,null,service general,6,positive
535171,535171:4,Loved it!,loved it,0.636,null,restaurant general,6,positive
535248,535248:1,The shrimp scampi was excellent and the antipasti were plentiful.,the shrimp scampi was excellent and the antipasti were plentiful,0.5719,shrimp scampi,food quality,6,positive
535248,535248:1,The shrimp scampi was excellent and the antipasti were plentiful.,the shrimp scampi was excellent and the antipasti were plentiful,0.5719,antipasti,food style options,6,positive
