reviewID,sentenceID,sentenceText,processedText,sentimentScore,target,category,part,polarity
1004293,1004293:0,"Judging from previous posts this used to be a good place, but not any longer.",judging from previous posts this used to be a good place but not any longer,0.2382,place,restaurant general,1,negative
1004293,1004293:1,"We, there were four of us, arrived at noon - the place was empty - and the staff acted like we were imposing on them and they were very rude.",we there were four of us arrived at noon the place was empty and the staff acted like we were imposing on them and they were very rude,-0.4576,staff,service general,1,negative
1004293,1004293:2,"They never brought us complimentary noodles, ignored repeated requests for sugar, and threw our dishes on the table.",they never brought us complimentary noodles ignored repeated requests for sugar and threw our dishes on the table,-0.5727,null,service general,1,negative
1004293,1004293:3,The food was lousy - too sweet or too salty and the portions tiny.,the food was lousy too sweet or too salty and the portions tiny,-0.128,food,food quality,1,negative
1004293,1004293:3,The food was lousy - too sweet or too salty and the portions tiny.,the food was lousy too sweet or too salty and the portions tiny,-0.128,portions,food style options,1,negative
1004293,1004293:4,"After all that, they complained to me about the small tip.",after all that they complained to me about the small tip,-0.4019,null,service general,1,negative
1004293,1004293:5,Avoid this place!,avoid this place,-0.3595,place,restaurant general,1,negative
1014458,1014458:0,"I have eaten at Saul, many times, the food is always consistently, outrageously good.",i have eaten at saul many times the food is always consistently outrageously good,0.1779,food,food quality,1,positive
1014458,1014458:1,Saul is the best restaurant on Smith Street and in Brooklyn.,saul is the best restaurant on smith street and in brooklyn,0.6369,saul,restaurant general,1,positive
1014458,1014458:2,The duck confit is always amazing and the foie gras terrine with figs was out of this world.,the duck confit is always amazing and the foie gras terrine with figs was out of this world,0.5859,foie gras terrine with figs,food quality,1,positive
1014458,1014458:2,The duck confit is always amazing and the foie gras terrine with figs was out of this world.,the duck confit is always amazing and the foie gras terrine with figs was out of this world,0.5859,duck confit,food quality,1,positive
1014458,1014458:3,The wine list is interesting and has many good values.,the wine list is interesting and has many good values,0.8074,wine list,drinks style options,1,positive
1014458,1014458:3,The wine list is interesting and has many good values.,the wine list is interesting and has many good values,0.8074,wine list,drinks prices,1,positive
1014458,1014458:4,"For the price, you cannot eat this well in Manhattan.",for the price you can not eat this well in manhattan,0.3346,null,restaurant prices,1,positive
1014458,1014458:4,"For the price, you cannot eat this well in Manhattan.",for the price you can not eat this well in manhattan,0.3346,null,food quality,1,positive
1016296,1016296:0,I was very disappointed with this restaurant.,i was very disappointed with this restaurant,-0.5256,restaurant,restaurant general,1,negative
1016296,1016296:1,Ive asked a cart attendant for a lotus leaf wrapped rice and she replied back rice and just walked away.,ive asked a cart attendant for a lotus leaf wrapped rice and she replied back rice and just walked away,0.0,cart attendant,service general,1,negative
1016296,1016296:2,I had to ask her three times before she finally came back with the dish Ive requested.,i had to ask her three times before she finally came back with the dish ive requested,0.0,null,service general,1,negative
1016296,1016296:3,"Food was okay, nothing great.",food was okay nothing great,-0.3387,food,food quality,1,neutral
1016296,1016296:4,Chow fun was dry; pork shu mai was more than usually greasy and had to share a table with loud and rude family. ,chow fun was dry pork shu mai was more than usually greasy and had to share a table with loud and rude family,0.3612,chow fun,food quality,1,negative
1016296,1016296:4,Chow fun was dry; pork shu mai was more than usually greasy and had to share a table with loud and rude family. ,chow fun was dry pork shu mai was more than usually greasy and had to share a table with loud and rude family,0.3612,pork shu mai,food quality,1,negative
1016296,1016296:4,Chow fun was dry; pork shu mai was more than usually greasy and had to share a table with loud and rude family. ,chow fun was dry pork shu mai was more than usually greasy and had to share a table with loud and rude family,0.3612,null,restaurant miscellaneous,1,negative
1016296,1016296:5,I/we will never go back to this place again.,i we will never go back to this place again,0.0,place,restaurant general,1,negative
1028246,1028246:0,"Went on a 3 day oyster binge, with Fish bringing up the closing, and I am so glad this was the place it O trip ended, because it was so great!",went on a 3 day oyster binge with fish bringing up the closing and i am so glad this was the place it o trip ended because it was so great,0.886,fish,restaurant general,1,positive
1028246,1028246:1,"Service was devine, oysters where a sensual as they come, and the price can't be beat!!!",service was devine oysters where a sensual as they come and the price can t be beat,0.0,service,service general,1,positive
1028246,1028246:1,"Service was devine, oysters where a sensual as they come, and the price can't be beat!!!",service was devine oysters where a sensual as they come and the price can t be beat,0.0,oysters,food quality,1,positive
1028246,1028246:1,"Service was devine, oysters where a sensual as they come, and the price can't be beat!!!",service was devine oysters where a sensual as they come and the price can t be beat,0.0,null,restaurant prices,1,positive
1028246,1028246:2,You can't go wrong here.,you can t go wrong here,0.3724,null,restaurant general,1,positive
1032695,1032695:0,Every time in New York I make it a point to visit Restaurant Saul on Smith Street.,every time in new york i make it a point to visit restaurant saul on smith street,0.0,restaurant saul,restaurant general,1,positive
1032695,1032695:1,"Everything is always cooked to perfection, the service is excellent, the decor cool and understated.",everything is always cooked to perfection the service is excellent the decor cool and understated,0.8658,null,food quality,1,positive
1032695,1032695:1,"Everything is always cooked to perfection, the service is excellent, the decor cool and understated.",everything is always cooked to perfection the service is excellent the decor cool and understated,0.8658,service,service general,1,positive
1032695,1032695:1,"Everything is always cooked to perfection, the service is excellent, the decor cool and understated.",everything is always cooked to perfection the service is excellent the decor cool and understated,0.8658,decor,ambience general,1,positive
1032695,1032695:2,I had the duck breast special on my last visit and it was incredible.,i had the duck breast special on my last visit and it was incredible,0.4019,duck breast special,food quality,1,positive
1032695,1032695:3,Can't wait wait for my next visit.,can t wait wait for my next visit,0.0,null,restaurant general,1,positive
1041457,1041457:1,And I hate to say this but I doubt I'll ever go back. ,and i hate to say this but i doubt i ll ever go back,-0.6808,null,restaurant general,1,negative
1041457,1041457:2,"The food is very average...the Thai fusion stuff is a bit too sweet, every thing they serve is too sweet here.",the food is very average the thai fusion stuff is a bit too sweet every thing they serve is too sweet here,0.7184,food,food quality,1,negative
1041457,1041457:2,"The food is very average...the Thai fusion stuff is a bit too sweet, every thing they serve is too sweet here.",the food is very average the thai fusion stuff is a bit too sweet every thing they serve is too sweet here,0.7184,thai fusion stuff,food quality,1,negative
1041457,1041457:2,"The food is very average...the Thai fusion stuff is a bit too sweet, every thing they serve is too sweet here.",the food is very average the thai fusion stuff is a bit too sweet every thing they serve is too sweet here,0.7184,null,food quality,1,negative
1041457,1041457:3,The only thing I moderately enjoyed was their Grilled Chicken special with Edamame Puree.,the only thing i moderately enjoyed was their grilled chicken special with edamame puree,0.7184,grilled chicken special with edamame puree,food quality,1,positive
1041457,1041457:4,I had never had Edamame pureed before but I thought it was innovative and tasty (could've used a bit more salt).,i had never had edamame pureed before but i thought it was innovative and tasty could ve used a bit more salt,0.5927,edamame pureed,food quality,1,positive
1041457,1041457:4,I had never had Edamame pureed before but I thought it was innovative and tasty (could've used a bit more salt).,i had never had edamame pureed before but i thought it was innovative and tasty could ve used a bit more salt,0.5927,edamame pureed,food style options,1,positive
1041457,1041457:6,"The decor is night tho...but they REALLY need to clean that vent in the ceiling...its quite un-appetizing, and kills your effort to make this place look sleek and modern.",the decor is night tho but they really need to clean that vent in the ceiling its quite un appetizing and kills your effort to make this place look sleek and modern,-0.0362,place,ambience general,1,negative
1041457,1041457:6,"The decor is night tho...but they REALLY need to clean that vent in the ceiling...its quite un-appetizing, and kills your effort to make this place look sleek and modern.",the decor is night tho but they really need to clean that vent in the ceiling its quite un appetizing and kills your effort to make this place look sleek and modern,-0.0362,decor,ambience general,1,positive
1041457,1041457:6,"The decor is night tho...but they REALLY need to clean that vent in the ceiling...its quite un-appetizing, and kills your effort to make this place look sleek and modern.",the decor is night tho but they really need to clean that vent in the ceiling its quite un appetizing and kills your effort to make this place look sleek and modern,-0.0362,vent,ambience general,1,negative
1053543,1053543:2,"Their sake list was extensive, but we were looking for Purple Haze, which wasn't listed but made for us upon request!",their sake list was extensive but we were looking for purple haze which wasn t listed but made for us upon request,0.0,sake list,drinks style options,1,positive
1053543,1053543:2,"Their sake list was extensive, but we were looking for Purple Haze, which wasn't listed but made for us upon request!",their sake list was extensive but we were looking for purple haze which wasn t listed but made for us upon request,0.0,null,service general,1,positive
1053543,1053543:3,"The spicy tuna roll was unusually good and the rock shrimp tempura was awesome, great appetizer to share!",the spicy tuna roll was unusually good and the rock shrimp tempura was awesome great appetizer to share,0.9311,spicy tuna roll,food quality,1,positive
1053543,1053543:3,"The spicy tuna roll was unusually good and the rock shrimp tempura was awesome, great appetizer to share!",the spicy tuna roll was unusually good and the rock shrimp tempura was awesome great appetizer to share,0.9311,rock shrimp tempura,food quality,1,positive
1053543,1053543:4,We went around 9:30 on a Friday and it had died down a bit by then so the service was great!,we went around 9 30 on a friday and it had died down a bit by then so the service was great,0.2003,service,service general,1,positive
1055910,1055910:0,we love th pink pony.,we love th pink pony,0.6369,pink pony,restaurant general,1,positive
1055910,1055910:1,THe perfect spot.,the perfect spot,0.5719,spot,restaurant general,1,positive
1055910,1055910:2,Food-awesome.,food awesome,0.0,food,food quality,1,positive
1055910,1055910:3,Service- friendly and attentive.,service friendly and attentive,0.4939,service,service general,1,positive
1055910,1055910:4,Ambiance- relaxed and stylish.,ambiance relaxed and stylish,0.4939,ambiance,ambience general,1,positive
1055910,1055910:5,"Don't judge this place prima facie, you have to try it to believe it, a home away from home for the literate heart.",don t judge this place prima facie you have to try it to believe it a home away from home for the literate heart,0.0,place,restaurant general,1,positive
1058221,1058221:2,the food is decent.,the food is decent,0.0,food,food quality,1,neutral
1058221,1058221:3,"however, it's the service that leaves a bad taste in my mouth.",however it s the service that leaves a bad taste in my mouth,-0.5423,service,service general,1,negative
1058221,1058221:4,"i happen to have a policy that goes along with a little bit of self-respect, which includes not letting a waiter intimidate me, i.e. make me feel bad asking for trivialities like water, or the check.",i happen to have a policy that goes along with a little bit of self respect which includes not letting a waiter intimidate me i e make me feel bad asking for trivialities like water or the check,-0.3417,waiter,service general,1,negative
1058221,1058221:5,"i know, you were too busy showing off your vintage tee shirt and looking bored, but my agenda is i'm here to eat and enjoy the company of friends, seeking a pleasant experience.",i know you were too busy showing off your vintage tee shirt and looking bored but my agenda is i m here to eat and enjoy the company of friends seeking a pleasant experience,0.9239,null,service general,1,negative
1058221,1058221:6,"well, i didn't find it there, and trust, i have told everyone i can think of about my experience. ",well i didn t find it there and trust i have told everyone i can think of about my experience,0.6597,null,restaurant general,1,negative
1058221,1058221:7,the last time i walked by it looked pretty empty. hmmm.,the last time i walked by it looked pretty empty hmmm,0.34,null,restaurant miscellaneous,1,negative
1062641,1062641:0,This place has got to be the best japanese restaurant in the new york area.,this place has got to be the best japanese restaurant in the new york area,0.6369,place,restaurant general,1,positive
1062641,1062641:1,I had a great experience.,i had a great experience,0.6249,null,restaurant general,1,positive
1062641,1062641:2,Food is great.,food is great,0.6249,food,food quality,1,positive
1062641,1062641:3,Service is top notch.,service is top notch,0.2023,service,service general,1,positive
1062641,1062641:4,I have been going back again and again.,i have been going back again and again,0.0,null,restaurant general,1,positive
1064477,1064477:0,"I tend to judge a sushi restaurant by its sea urchin, which was heavenly at sushi rose.",i tend to judge a sushi restaurant by its sea urchin which was heavenly at sushi rose,0.6124,sea urchin,food quality,1,positive
1064477,1064477:1,"It melted in my little mouth and the perfect consistency-not too fishy, creamy, and slightly buttery.",it melted in my little mouth and the perfect consistency not too fishy creamy and slightly buttery,0.5719,null,food quality,1,positive
1064477,1064477:2,The sushi seemed pretty fresh and was adequately proportioned.,the sushi seemed pretty fresh and was adequately proportioned,0.6705,sushi,food quality,1,positive
1064477,1064477:2,The sushi seemed pretty fresh and was adequately proportioned.,the sushi seemed pretty fresh and was adequately proportioned,0.6705,sushi,food style options,1,positive
1064477,1064477:3,The rice to fish ration was also good--they didn't try to overpack the rice.,the rice to fish ration was also good they didn t try to overpack the rice,0.0,rice to fish ration,food style options,1,positive
1064477,1064477:4,We took advanatage of the half price sushi deal on saturday so it was well worth it.,we took advanatage of the half price sushi deal on saturday so it was well worth it,0.5046,half price sushi deal,food quality,1,positive
1064477,1064477:4,We took advanatage of the half price sushi deal on saturday so it was well worth it.,we took advanatage of the half price sushi deal on saturday so it was well worth it,0.5046,half price sushi deal,food prices,1,positive
1074868,1074868:2,Surprisingly nothing could be further from the truth.,surprisingly nothing could be further from the truth,0.5423,null,restaurant miscellaneous,1,positive
1074868,1074868:3,"In the evening, this place attracted a well dressed, with it, NY crowd.",in the evening this place attracted a well dressed with it ny crowd,0.5994,crowd,restaurant miscellaneous,1,positive
1074868,1074868:4,The food was well prepared and the service impecable.,the food was well prepared and the service impecable,0.4588,food,food quality,1,positive
1074868,1074868:4,The food was well prepared and the service impecable.,the food was well prepared and the service impecable,0.4588,service,service general,1,positive
1074868,1074868:5,I'm going back.,i m going back,0.0,null,restaurant general,1,positive
1084394,1084394:1,Quite simply it's like stepping out of Manhattan and into a haven of tranquility.,quite simply it s like stepping out of manhattan and into a haven of tranquility,0.6771,null,ambience general,1,positive
1084394,1084394:3,The Prix Fixe menu is worth every penny and you get more than enough (both in quantity AND quality).,the prix fixe menu is worth every penny and you get more than enough both in quantity and quality,0.2263,prix fixe menu,food quality,1,positive
1084394,1084394:3,The Prix Fixe menu is worth every penny and you get more than enough (both in quantity AND quality).,the prix fixe menu is worth every penny and you get more than enough both in quantity and quality,0.2263,prix fixe menu,food style options,1,positive
1084394,1084394:3,The Prix Fixe menu is worth every penny and you get more than enough (both in quantity AND quality).,the prix fixe menu is worth every penny and you get more than enough both in quantity and quality,0.2263,prix fixe menu,food prices,1,positive
1084394,1084394:4,I will be going back and heartily recommend it!,i will be going back and heartily recommend it,0.4199,null,restaurant general,1,positive
1086415,1086415:1,"It is terrific, as is the value.",it is terrific as is the value,0.6705,null,food quality,1,positive
1086415,1086415:1,"It is terrific, as is the value.",it is terrific as is the value,0.6705,null,food prices,1,positive
1086415,1086415:2,"$6 and there is much tasty food, all of it fresh and continually refilled.",6 and there is much tasty food all of it fresh and continually refilled,0.3182,food,food style options,1,positive
1086415,1086415:2,"$6 and there is much tasty food, all of it fresh and continually refilled.",6 and there is much tasty food all of it fresh and continually refilled,0.3182,food,food quality,1,positive
1086415,1086415:2,"$6 and there is much tasty food, all of it fresh and continually refilled.",6 and there is much tasty food all of it fresh and continually refilled,0.3182,food,food prices,1,positive
1086415,1086415:3,"I am not a vegetarian but, almost all the dishes were great.",i am not a vegetarian but almost all the dishes were great,0.7684,dishes,food quality,1,positive
1086415,1086415:5,Go hungry and enjoy.,go hungry and enjoy,0.4939,null,restaurant general,1,positive
1086478,1086478:0,"The food here is rather good, but only if you like to wait for it.",the food here is rather good but only if you like to wait for it,0.6369,food,food quality,1,positive
1086478,1086478:0,"The food here is rather good, but only if you like to wait for it.",the food here is rather good but only if you like to wait for it,0.6369,null,service general,1,negative
1086478,1086478:1,"I like the somosas, chai, and the chole, but the dhosas and dhal were kinda dissapointing.",i like the somosas chai and the chole but the dhosas and dhal were kinda dissapointing,0.1901,somosas,food quality,1,positive
1086478,1086478:1,"I like the somosas, chai, and the chole, but the dhosas and dhal were kinda dissapointing.",i like the somosas chai and the chole but the dhosas and dhal were kinda dissapointing,0.1901,chai,food quality,1,positive
1086478,1086478:1,"I like the somosas, chai, and the chole, but the dhosas and dhal were kinda dissapointing.",i like the somosas chai and the chole but the dhosas and dhal were kinda dissapointing,0.1901,chole,food quality,1,positive
1086478,1086478:1,"I like the somosas, chai, and the chole, but the dhosas and dhal were kinda dissapointing.",i like the somosas chai and the chole but the dhosas and dhal were kinda dissapointing,0.1901,dhosas,food quality,1,negative
1086478,1086478:1,"I like the somosas, chai, and the chole, but the dhosas and dhal were kinda dissapointing.",i like the somosas chai and the chole but the dhosas and dhal were kinda dissapointing,0.1901,dhal,food quality,1,negative
1086478,1086478:2,"The service varys from day to day- sometimes they're very nice, and sometimes not.",the service varys from day to day sometimes they re very nice and sometimes not,0.4754,service,service general,1,negative
1086478,1086478:3,"The kitchen however, is almost always slow.",the kitchen however is almost always slow,0.0,kitchen,service general,1,negative
1086478,1086478:4,"Also, specify if you like your food spicy- its rather bland if you don't.",also specify if you like your food spicy its rather bland if you don t,0.3612,food,food quality,1,negative
1086478,1086478:5,"The ambience is pretty and nice for conversation, so a casual lunch here would probably be best.",the ambience is pretty and nice for conversation so a casual lunch here would probably be best,0.9112,ambience,ambience general,1,positive
1086478,1086478:5,"The ambience is pretty and nice for conversation, so a casual lunch here would probably be best.",the ambience is pretty and nice for conversation so a casual lunch here would probably be best,0.9112,null,restaurant miscellaneous,1,positive
1090587,1090587:1,If you've ever been along the river in Weehawken you have an idea of the top of view the chart house has to offer.,if you ve ever been along the river in weehawken you have an idea of the top of view the chart house has to offer,0.2023,view,location general,1,positive
1090587,1090587:2,Add to that great service and great food at a reasonable price and you have yourself the beginning of a great evening.,add to that great service and great food at a reasonable price and you have yourself the beginning of a great evening,0.9231,service,service general,1,positive
1090587,1090587:2,Add to that great service and great food at a reasonable price and you have yourself the beginning of a great evening.,add to that great service and great food at a reasonable price and you have yourself the beginning of a great evening,0.9231,food,food quality,1,positive
1090587,1090587:2,Add to that great service and great food at a reasonable price and you have yourself the beginning of a great evening.,add to that great service and great food at a reasonable price and you have yourself the beginning of a great evening,0.9231,food,food prices,1,positive
1090587,1090587:3,The lava cake dessert was incredible and I recommend it.,the lava cake dessert was incredible and i recommend it,0.3612,lava cake dessert,food quality,1,positive
1102681,1102681:0,"Once you step into Cosette, you're miraculously in a small, off-the-beaten path Parisian bistro.",once you step into cosette you re miraculously in a small off the beaten path parisian bistro,0.0,cosette,ambience general,1,positive
1102681,1102681:1,"This tiny restaurant is as cozy as it gets, with that certain Parisian flair.",this tiny restaurant is as cozy as it gets with that certain parisian flair,0.2732,restaurant,ambience general,1,positive
1102681,1102681:2,"The food was average to above-average; the French Onion soup filling yet not overly impressive, and the desserts not brilliant in any way.",the food was average to above average the french onion soup filling yet not overly impressive and the desserts not brilliant in any way,-0.6979,food,food quality,1,positive
1102681,1102681:2,"The food was average to above-average; the French Onion soup filling yet not overly impressive, and the desserts not brilliant in any way.",the food was average to above average the french onion soup filling yet not overly impressive and the desserts not brilliant in any way,-0.6979,french onion soup,food quality,1,negative
1102681,1102681:2,"The food was average to above-average; the French Onion soup filling yet not overly impressive, and the desserts not brilliant in any way.",the food was average to above average the french onion soup filling yet not overly impressive and the desserts not brilliant in any way,-0.6979,french onion soup,food style options,1,positive
1102681,1102681:2,"The food was average to above-average; the French Onion soup filling yet not overly impressive, and the desserts not brilliant in any way.",the food was average to above average the french onion soup filling yet not overly impressive and the desserts not brilliant in any way,-0.6979,desserts,food quality,1,negative
1102681,1102681:3,"However, go for the ambience, and consider the food just a companion for a trip across the world!",however go for the ambience and consider the food just a companion for a trip across the world,0.0,ambience,ambience general,1,positive
1102681,1102681:3,"However, go for the ambience, and consider the food just a companion for a trip across the world!",however go for the ambience and consider the food just a companion for a trip across the world,0.0,food,food quality,1,neutral
1118167,1118167:1,IT WAS HORRIBLE.,it was horrible,-0.5423,null,restaurant general,1,negative
